{
  "id": "WA-DL-CLASS-A",
  "version": "0.1.0",
  "issuer": {
    "id": "did:example:123?linked-domains=3",
    "name": "Washington State Government",
    "styles": {}
  },
  "output_descriptors": [
    {
      "schema": [
        {
          "uri": "http://washington-state-schemas.org/1.0.0/driver-license.json"
        }
      ],
      "display": {
        "title": {
          "path": [
            "$.name",
            "$.vc.name"
          ],
          "fallback": "Washington State Driver License"
        },
        "subtitle": {
          "path": [
            "$.class",
            "$.vc.class"
          ],
          "fallback": "Class A, Commercial"
        },
        "description": {
          "text": "License to operate a vehicle with a gross combined weight rating (GCWR) of 26,001 or more pounds, as long as the GVWR of the vehicle(s) being towed is over 10,000 pounds."
        },
        "properties": [
          {
            "path": [
              "$.donor",
              "$.vc.donor"
            ],
            "fallback": "Unknown",
            "label": "Organ Donor"
          }
        ]
      },
      "styles": {}
    }
  ],
  "presentation_definition": {}
}